{
  "event_id": "00000000000000000000000000000000",
  "timestamp": 1700000000.0,
  "platform": "ruby",
  "level": "warning",
  "environment": "production",
  "release": "9f8c2a1d",
  "server_name": "web.1.dispatch.internal",
  "transaction": "orders#update",
  "exception": {
    "values": [
      {
        "type": "ArgumentError",
        "value": "invalid coupon code",
        "mechanism": {
          "type": "generic",
          "handled": true
        },
        "stacktrace": {
          "frames": [
            {
              "abs_path": "/srv/app/app/services/order_updater.rb",
              "filename": "app/services/order_updater.rb",
              "function": "call",
              "lineno": 8,
              "in_app": true,
              "pre_context": [
                "    @order = order",
                "  end",
                "",
                "  def call(attrs)",
                "    @order.assign_attributes(attrs)"
              ],
              "context_line": "    Inventory.reserve!(@order)",
              "post_context": [
                "    @order.save!",
                "  end",
                "end"
              ]
            }
          ]
        }
      }
    ]
  },
  "request": {
    "url": "https://shop.example.com/orders/42",
    "method": "POST",
    "query_string": "ref=email",
    "headers": {
      "User-Agent": "Mozilla/5.0 (Macintosh; Intel Mac OS X 10_15_7) Chrome/124.0",
      "Referer": "https://shop.example.com/orders",
      "Accept": "text/html",
      "Host": "shop.example.com",
      "X-Request-Id": "5e2c1b90-7a44-4f0b-9e21-0c1d2e3f4a5b"
    },
    "env": {
      "REMOTE_ADDR": "203.0.113.7"
    }
  },
  "user": {
    "id": "u_99",
    "email": "casey@example.com",
    "ip_address": "203.0.113.7"
  },
  "tags": {
    "request_id": "5e2c1b90-7a44-4f0b-9e21-0c1d2e3f4a5b",
    "transaction": "orders#update",
    "area": "import"
  },
  "sdk": {
    "name": "dispatch-rails",
    "version": "0.6.0"
  }
}
