{
  "event_id": "00000000000000000000000000000000",
  "timestamp": 1700000000.0,
  "platform": "javascript",
  "level": "error",
  "environment": "production",
  "release": "9f8c2a1d",
  "exception": {
    "values": [
      {
        "type": "Error",
        "value": "Payment gateway timeout",
        "mechanism": {
          "type": "onunhandledrejection",
          "handled": false
        },
        "stacktrace": {
          "frames": [
            {
              "function": "submitPayment",
              "filename": "https://shop.example.com/assets/checkout-3f9a.js",
              "abs_path": "https://shop.example.com/assets/checkout-3f9a.js",
              "lineno": 120,
              "colno": 11,
              "in_app": true
            },
            {
              "function": "callGateway",
              "filename": "https://shop.example.com/assets/payments-7c2e.js",
              "abs_path": "https://shop.example.com/assets/payments-7c2e.js",
              "lineno": 64,
              "colno": 22,
              "in_app": true
            }
          ]
        }
      }
    ]
  },
  "breadcrumbs": {
    "values": [
      {
        "timestamp": 1699999990.0,
        "category": "ui.click",
        "level": "info",
        "message": "button \"Pay now\""
      },
      {
        "timestamp": 1699999995.0,
        "category": "console",
        "level": "error",
        "message": "gateway retry 3/3"
      }
    ]
  },
  "user_path": [
    "button \"Pay now\""
  ],
  "request": {
    "url": "https://shop.example.com/checkout",
    "headers": {
      "User-Agent": "Mozilla/5.0 (Macintosh; Intel Mac OS X 10_15_7) Chrome/124.0"
    }
  },
  "user": {
    "email": "casey@example.com",
    "id": "u_99"
  },
  "tags": {
    "area": "checkout"
  }
}
